type,name,description,quality,domain_specificity,domain,origin_instance_id,parent_content_hash
trade_off_config,separate-synthesis-from-chronology,"When synthesis and chronological narrative could be blended into a single account: separate them; tag synthesis explicitly inline or place in a clearly-labelled section",100,25,"writing,analysis",00000000-0000-7000-8000-000000000001,
trade_off_config,attribute-insights-to-actual-scope,"When a cross-session insight appears during description of a specific session: attribute it to the cross-session scope, not to the specific session where it is mentioned",100,25,"writing,analysis",00000000-0000-7000-8000-000000000001,
trade_off_config,logical-structure-over-temporal-sequence,"When material has both temporal and logical structure: organise by logical dependency; note temporal sequence only where it adds information not already captured by the logical structure",100,0,,00000000-0000-7000-8000-000000000001,
trade_off_config,report-without-editorial-admiration,"When tempted to comment on how an insight was reached or the quality of a group's process: report what happened and what was concluded; do not add evaluative framing about the process itself",100,25,"writing,management",00000000-0000-7000-8000-000000000001,
role_component,mark-provenance-of-post-event-reflections,"Mark sections containing post-event reflection or facilitator commentary as distinct from the record of what happened during the event",100,25,"writing,management",00000000-0000-7000-8000-000000000001,
